id,date,href,text,title,title_from_page,topic,url,article_file,results_file
1673,2023-12-11 20:00:33+00:00,/news/uk-england-manchester-67683701,"A businessman who has lost five members of his family in a bombing in Gaza said he feels ""broken"" and ""destroyed"". Dalloul al-Neder, who owns a takeaway in Manchester, said his mother, brother, pregnant sister-in-law and two nieces all died in the strike on their home in Jabalia over a week ago. He said he feared for the rest of his relatives who were injured, including his wife and six-month-old daughter. He knows his daughter was pulled from the rubble but has no more news.  ""I'm feeling broken about my family. Destroyed,"" he told BBC North West Tonight. He said all he knows about his baby daughter is that she was pulled from the rubble. ""I only know they saved them from the rubble and they are injured. ""    Mr al-Neder paid tribute to his 56-year-old mother. ""My mum was a lovely woman. She never hurt anybody,"" he said. He said he has had to close his takeaway in Burnage, the Royal Grill House, as he grieves for his family and waits to hear news of his other relatives. He said he does not feel able to open the doors again and is now looking to sell the business.  ""I wouldn't be capable of running this business any more,"" he said. He said he has appreciated the support of the community in Manchester.  ""They have been very kind. A lot have come with flowers and donations,"" he said. And he said his hope now is for an end to the bloodshed. ""No one is safe in Gaza,"" he said. He said the last time he contacted his mother, she told him there was ""no food, no water, no electricity no gas"". ""If there is anyone who could seriously take action to demand immediately force ceasefire to save lives and stop this bloodshed,"" he said. ""People in Gaza want to live in peace. "" Why not follow BBC North West on Facebook, X and Instagram? You can also send story ideas to northwest. newsonline@bbc. co. uk",'Broken' takeaway boss loses five relatives in Gaza,Israel Gaza war: 'Broken' takeaway boss loses five relatives in bombing,israel-gaza_war,http://bbc.co.uk/news/uk-england-manchester-67683701,articles/article_1673.txt,results/article_1673.txt.json
1676,2023-12-18 06:07:40+00:00,/news/uk-england-bristol-67741956,"A man originally from Gaza has been hospitalised after being on hunger strike for nearly two months over the Israel-Gaza war. Wael Arafat, 28, moved from Deir Al Balah to Bristol when he was young and is calling for a ceasefire. His mother, Patricia Davis-Thomas, said he is ""very unwell"" and that he has 17 family members who have been killed. She explained that seven days after he started the hunger strike, they had to call for an ambulance. Israel says that for the first time since the fighting began in October, aid has entered Gaza through the Kerem Shalom crossing.  Until now there have only been limited deliveries through the Rafah Crossing with Egypt.  An increasing number of countries are calling for a ceasefire. in the Israel-Gaza war. Mr Arafat from Bristol has been refusing food at the Royal United Hospital in Bath. Speaking to BBC Arabic, Mr Arafat said: ""I probably have a week or two before I die.  ""I want the world to do something and not for me, but I want the world to do something for the people of Gaza, for the children, the elderly and the youth. "" Ms Davis-Thomas said: ""He came to this country to be safe.  ""He's been traumatised, but he's always had a very strong link to Palestine, even though he left there when he was very young.  ""He expresses his distress around the children that are being harmed. He remembers himself as a child living in Palestine, under occupation. ""  Mr Arafat told the BBC he did not want to stop the hunger strike until, ""they hear us and know that we are not animals, we are humans and when I see the ceasefire in Gaza. "" Ms Davis-Thomas added: ""I took in a young lad of 14. I brought him up in the way he should have been brought up, in the way that his family would have wanted him to be brought up. "" ""So I learnt about his culture. I knew nothing about Palestine before he came to me. I helped him in his education. I got him to this point. "" ""Now I just feel I'm going to lose my son and nobody has a right to die like that. I'm trying to save my son here. "" She said she wanted people to think about those in Palestine running for their and their children's lives.  Ms David-Thomas said he is ""critical"" in hospital and has managed to encourage him to have a little fluid. She added: ""I tell him every day in hospital - you have a right to protest. We all have a right to protest. But you don't have to take it to the point where you have to die. "" ""He wants to be heard, he doesn't want to die. He's expressed that to the doctors and they are trying to do their best by him. ""But if he doesn't take fluids, if he isn't encouraged to start to eat, then he will die. "" Israeli Prime Minister Benjamin Netanyahu has said the Israeli government is still trying to complete the recovery of all the hostages held in Gaza, saying military pressure on Hamas was needed to secure their release. Mr Netanyahu has indicated that talks are happening, and there are reports which suggest both Egypt and Qatar are involved in the discussions. But Hamas has said there will be no negotiations to release hostages ""unless the aggression against our people stops once and for all"". Follow BBC West on Facebook, X and Instagram. Send your story ideas to: bristol@bbc. co. uk ",'I probably have a week or two before I die',Israel-Gaza war: Man on hunger strike hospitalised calling for ceasefire,"israel,palestinian_territories,israel-gaza_war,gaza",http://bbc.co.uk/news/uk-england-bristol-67741956,articles/article_1676.txt,results/article_1676.txt.json
1677,2023-12-04 20:39:35+00:00,/news/world-middle-east-67592794,"The BBC's Rushdi Abualouf, who has reported from Gaza for decades, left the territory with his family on 20 November for the sake of their safety. It was six weeks after the Hamas attacks on southern Israel that has led to weeks of Israeli bombardment within Gaza. He is now in Istanbul, Turkey. Speaking on the BBC's Newshour programme, he described how it felt to leave his home and observe Gaza from the outside. My family and I grew up in Gaza, we were born in Gaza. I really feel sad that I have had to leave in this way.  I have a memory from every corner of my house, and from every corner of my neighbourhood.  The rest of my wife's family - her father, mother and brother - are still there, while my father, brothers and sisters also remain in Gaza. To be honest, it's more difficult for me to watch Gaza from the outside, because when I was there, inside the enclave, I was busy dealing with too many things and not thinking about the situation in the Strip.  Now, when you are out, you have more time to think. And it's very hard for me to imagine that I will no longer see my house or sleep in my bed, and I will no longer see my neighbours and my neighbourhood. Since we left for Istanbul, we were told that our home was destroyed. I mean the whole building, the whole neighbourhood was destroyed.  Some of my BBC Arabic colleagues are still there. I met them all one night before I left because I wasn't sure about the timing, and there was a surprise call in the night telling me to leave.  I told them I would do everything I could to get them out.  ""Be strong and work together, the BBC is very proud of you, the BBC will do everything possible to protect you and try to get you out,"" I told them. I've called them every morning since I left Gaza. I'm always with them, always advising them, helping them solve every problem they are facing in their location or with their family, and hopefully they will be out soon. My family had a chance to leave right at the beginning. When Hamas attacked southern Israel on 7 October, my first call was to the BBC to tell them what happened. The second was to my wife. I said to her: ""Please prepare your bag, you have to leave Gaza now. "" I was expecting a very big retaliation from Israel, and the Rafah crossing was still open for the first couple of days after the Hamas raids. At the beginning, my wife did not realise how big the situation would be and how dangerous it was. I would have to stay to work, and because she didn't want us to be apart, she refused and said: ""We will stay together, live together. "" On the third day we lost this chance - the Rafah crossing was bombed and closed. And then you have to deal with so many things.  You have to deal with your old father who lives far away from you. You have to learn to deal with your family and you have to deal with your job.  You have to report, and all the time in the back of your mind is your father, in the back of your mind is your wife, your kids, your place - whenever they drop a bomb, you think: is it close to your house?   After we were forced to leave Gaza City, we first arrived in Khan Younis and stayed with family for a couple of days.  Then there was a warning that the house would be bombed. So we had to leave and found ourselves with nowhere to go. I decided to put up a tent near a workspace I'd set up in Nasr hospital in Khan Younis. My family stayed there for about a week.  I found a house near the hospital so that they could be close to me, so if something happened I could rush to them.  My flat in Gaza City was 170 sq m, but now everyone was squeezed into one small room. They were worried about me not being with them all the time, and also there was not enough food. My wife was injured that day when she tried to come and see me. The kids were crying that they wanted to see their dad and they decided to go from the house to the hospital.  When they arrived, one of the buildings was hit - that day they almost died. Now that we are out, I know that I will definitely go back. I always say as a journalist that Gaza is the perfect place to be - because you will find a story on every corner.  But for me personally, my family has been suffering for a very long time.  I told my wife when we left Gaza, when we walked out of the gate: ""I will not let you go back under any circumstances.  ""So you have to start establishing your life somewhere else. ""  Now my kids are happy to be out, to go back to a normal life, though they still miss everything. But I am a journalist, and as soon as the situation allows me to go back to Gaza I will, because I'm connected to this story and I think those 2.3 million people in the Strip deserve having somebody to tell their story. ",'It's so much harder to watch Gaza from the outside',Rushdi Abualouf: 'It's so much harder to watch Gaza from the outside',"israel-gaza_war,gaza",http://bbc.co.uk/news/world-middle-east-67592794,articles/article_1677.txt,results/article_1677.txt.json
1678,2023-12-01 21:35:04+00:00,/news/world-middle-east-67595798,"""She doesn't deserve to wait for the next deal, just because she's not somebody's mother or grandmother,"" writes Or Neko Maymon on Facebook in Hebrew.  Or is talking about 27-year-old street artist and art student Inbar Haiman, who is his partner's sister.  Inbar was kidnapped by Hamas from the Supernova music festival in Israel on 7 October, and was seen days later in a hostage video circulated on social media, with blood on her face.  She is one of 16 women BBC Verify has identified as still being captive in Gaza, following a seven-day ceasefire between Israel and Hamas. This pause in fighting saw Hamas agree to release 110 hostages (including 78 women and children), in return for 240 Palestinian prisoners being freed from Israeli jails.  Israel's focus on securing the release of female hostages has raised and dashed hopes for the families of the women who are still left behind.  Since her kidnap, Inbar's friends and family have been campaigning for her release, and using the hashtag #FreePink, a reference to her street artist name.  ""I'm really not ready for you to take away my hope to see Inbar come back,"" Or wrote in another post three days ago.  In November, Inbar's boyfriend, 24-year-old Noam Alon, camped for 10 days in front of the central military headquarters in Tel Aviv, calling for the Israeli government to do more to secure Inbar's release.  Of the 237 people taken hostage by Hamas and five other armed Palestinian groups during the 7 October attacks, BBC News has verified that 115 are left in Gaza. An Israeli government spokesman says 135 people remain captive. There is no official published list of hostages, so the BBC has had to confirm names itself.  Among the remaining hostages are at least 16 women and 95 men. This number includes French-Mexican Orión Hernández Radoux, the boyfriend of 22-year-old Shani Louk, who was killed after being kidnapped from the Supernova musical festival.  Soon after the festival was attacked, a video began circulating widely on social media showing the body of a young woman being paraded through the streets. Shani's family was able to identify her in the footage from her dreadlocks and distinctive tattoos. At the end of October, Shani's mother Ricarda said she had been told by the Israeli military that a piece of skull bone belonging to her daughter had been found. Shani's body has not yet been recovered. In November, her boyfriend Orión turned 31 in captivity.  ""Today is Orión's birthday,"" wrote family friend Gabriel De la Fuente on Facebook in Spanish, ""already a month since his kidnapping, may God return you well. "" Orión is believed to have been snatched at the festival, and the Sun newspaper says it has seen threatening messages written in Arabic sent from his phone.  His friends and family join together in prayer each night at 7pm, in a WhatsApp group created to help them support each other.  ""Only by uniting together in prayer will we provide the spiritual strength and support that your soul needs right now, wherever it may be,"" writes Gabriel.  Families waiting for loved ones to come home have become a great source of support to each other, says Gil Dickmann, whose cousin Carmel Gat has been captive since 7 October. ""We became like a real large family of families,"" he told the BBC News channel. ""It feels as though, when their relatives are getting released, so are mine. "" Carmel, a 39-year-old occupational therapist from Tel Aviv, had been visiting parents in Be'eri on 7 October.  Her sister in law, Yarden Roman-Gat, was released by Hamas on Wednesday, and reunited with her husband and three-year-old daughter.  ""I wasn't even sure that she was alive until I saw her,"" Gil says of Yarden.   When the 36-year-old German-Israeli, her husband and daughter were captured, they managed to break out of the gunmen's car near the Gaza-Israel barrier, Gil explains.  The family then began to run away while being shot at. Realising she couldn't run fast enough, Yarden gave her daughter to her husband and surrendered so that the others could make their escape.  ""We were very, very happy to see her,"" says Gil.  But now the ceasefire is over, Gil grows more and more scared for his cousin Carmel, who has not yet come home.  ""We were very, very worried by the fact that the truce is ended,"" Gil says. ""I'm personally very worried for her. ""  Many people whose loved ones remain hostages in Gaza have been using social media to campaign for their release, share feelings and support each other in grief.  The mother of dual US-Israeli hostage Hersh Goldberg-Polin has been posting videos of herself talking about her son on his family's Bring Hersh Home Facebook page.  ""I wanted to share with you what happened last night when I woke up at 2:13 in the morning,"" Rachel told the Facebook page's 17,000 followers on Wednesday. ""I started to think about how much pain Hersh must be in. "" According to eye witnesses Rachel spoke with, Hersh lost half of his arm in a grenade explosion before he was kidnapped from the Supernova festival. Eyewitness accounts say the 23-year-old was seen being forced onto a white pick-up truck. The last-known signal from his phone came from just inside Gaza. ""It is really important that we get him home so that he can start the process of learning how to live his life in a very different way than he ever lived it before,"" says Rachel in one of her latest videos.  ""It's just another reason why we are tenaciously and tirelessly fighting for him to come home. "" Additional reporting by Emma Pengelly.",'I’m not ready to lose hope': The hostages still in Gaza,'I’m not ready to lose hope': The hostages still in Gaza,"israel,israel-gaza_war,hamas,gaza",http://bbc.co.uk/news/world-middle-east-67595798,articles/article_1678.txt,results/article_1678.txt.json
1679,2023-12-08 05:01:29+00:00,/news/world-67592468,"Yael Noy doesn't wear military fatigues, but she describes herself as being in battle right now, after the Hamas assault on 7 October.  ""I'm fighting to be good,"" she tells me. ""I'm fighting to stay moral when both sides are in such terrible pain. I'm fighting to be the same person I was before. ""  Yael heads a charity called Road to Recovery, a group of Israeli volunteers who drive sick Palestinians - mostly children - from checkpoints in the occupied West Bank and Gaza to hospital appointments in Israel.  Or did. The 1,000 or so volunteers can no longer take patients from Gaza, which is governed by Hamas. And four of them are dead - murdered as Palestinian gunmen stormed through their kibbutzim in southern Israel.  They include Vivian Silver, a renowned peace activist; Adi Dagan, who Yael describes as ""funny"" and always ready to step in and ferry patients at short notice in his big car; Tammy Suchman, a much-loved grandmother; and Eli Or-Gad, who loved talking about poetry.  Four other volunteers lost close family members on 7 October. About 1,200 people were killed in the Hamas attack on Israel. Since then, Gaza's Hamas-run health ministry says more than 17,177 people have been killed in the Israeli offensive which followed. Yael lives in northern Israel, but her parents are from kibbutz Alumim, one of the southern communities which was attacked - and they cowered as the assault unfolded, hour after terrifying hour.  Two of her nephews have been fighting in Gaza, in Israel's military response.     In the immediate aftermath of 7 October, Yael says she was so shaken that she could barely breathe.  ""Something was broken in my heart and I said that I would never talk to people in Gaza again,"" she tells me. But after a few days, she decided that she couldn't allow the atrocities to change her.  She and most of the Road to Recovery volunteers have continued to drive Palestinians from the West Bank to hospitals in Israel for cancer treatment, organ transplants and kidney dialysis. As soon as she can, she says she'll go and collect patients from Gaza again.  Yael refuses to dehumanise them, or equate them with Hamas, which is classed as a terrorist organisation in the UK and other countries. ""Like us they are victims of Hamas, so I think we should keep on helping them, because it's not their fault,"" she tells me over the phone.  ""We can't refuse to help a child with cancer. Our neighbours need help, so we need to help them. "" She worries for the families she knows in Gaza, with winter approaching and so many bombed houses now uninhabitable.   The parent of a 6-year-old child, who'd had an organ transplant, texted one of the Road to Recovery volunteers saying simply: ""We are okay. We are going to die here. "" Yael is also desperately concerned for two Road to Recovery volunteers, Oded Lifschitz and Chaim Peri, who are still being held hostage by Hamas.    Emotionally, she feels like she's being torn apart. She has uncles and cousins who are adamantly opposed to what she's doing and accuse her of helping Hamas.  And it's not just family members who disapprove. ""When I'm driving with Palestinians through checkpoints in the West Bank, soldiers have asked me how I can do what I'm doing,"" she tells me. ""Other people ask the same question. "" ""It's dangerous now to even talk about the suffering of the kids in Gaza - people look at me like I'm the enemy,"" she says, through sobs. ""But I'm not doing it for the Palestinians, I'm doing it because I want to be proud to be Israeli. I believe that whether you're an Israeli or a Palestinian, a Jew or an Arab, people are people. "" Some Palestinian families have reached out to find out how she is. But it's harder than ever now for those few people swimming against the tide by trying to bridge the divide between Israelis and Palestinians. ""Even people on the left say that we should flatten Gaza. Both sides have become more and more radicalised,"" Yael says.  ""I really don't know what will happen in the future. But I know that both of us will still live here, so we must find a solution. "" Since 7 October, some Road to Recovery volunteers have dropped out of driving altogether or decided to focus on taking medicines to displaced Israelis instead, while the war lasts. But other volunteers have stepped in, to make sure that sick Palestinians from the West Bank still get to appointments that are saving their lives. Yael says the charity will need support from the outside world to keep going because donations from within Israel have virtually stopped. But she is sure that, when it becomes possible, Road to Recovery will be collecting child patients from Gaza again - hoping that they will all have survived. ""It may be hard.  But we can't stop,"" she says. ""It's my mission and I have to do it. """,'We can't stop' - the Israeli woman still helping sick Palestinians,'We can't stop' - the Israeli woman still helping sick Palestinians,"israel,israel_and_the_palestinians,israel-gaza_war",http://bbc.co.uk/news/world-67592468,articles/article_1679.txt,results/article_1679.txt.json
