id,date,href,text,title,title_from_page,topic,url,article_file,results_file
1762,2023-12-12 06:00:34+00:00,/news/world-middle-east-67679634,"Danielle Waldman danced the last dance of her young life some time before dawn on 7 October. Soon afterwards she and her friends had to run for their lives, but they never made it home.  There is a record of her final moments - a brief video, recorded on a phone. It gives only a hint of the horrors to come. The 24-year-old sits in the back seat of a car with two friends - strands of her long curly hair escaping from her grey hoodie. All three are casually dressed. There are fleeting smiles and overlapping voices, and a glimpse of blue wrist bands from the Supernova trance music festival they have just attended. They are trying to remain calm, but they are being hunted. Danielle's boyfriend Noam Shai is in front, behind the wheel.  ""Want me to drive very, very fast?"" he asks. ""I know how to do that. ""  ""Correct,"" replies a female passenger. A bearded young man sitting beside Danielle tries to provide reassurance. ""We will be all right,"" he says. ""Everything is ok, right?"" Next, from the front, an urgent demand - ""left, or right?"" Then the video ends.   Minutes later Hamas gunmen riddled the car with bullets. Noam, Danielle, and their friends in the back seat were killed - as were nearly 360 other Israelis who went to dance at the festival in the Negev desert near the Gaza border.  The front seat passenger was taken hostage. When the sun set on that day, 1,200 Israelis had been slaughtered - either at the festival or in their homes in kibbutzim close to the border. It was the worst loss of Jewish life in a single day since the Holocaust. The vast majority were civilians. Since then, Israel has gone to war in Gaza ""to eradicate Hamas"", and Palestinians in turn have been slaughtered.  Almost 18,000 people have been killed at last count - according to the Hamas-run health ministry in Gaza - 7,300 of them children.  In Gaza now, as in Israel after 7 October, parents are burying their children. And for every parent, Palestinian or Israeli, the loss is incomparable. We meet Danielle's father Eyal in his art-filled office, high above Tel Aviv. He has long been a tech giant - who founded the Israeli chip maker Mellanox Technologies, and sold it for $6.8bn in 2019.  But now he is simply a father, raw with grief, robbed of his youngest daughter.  ""She was an amazing girl,"" he says in a voice laden with love and grief. ""She loved to dance. She loved animals. She loved people. She had many, many friends. She loved to snowboard, to scuba dive, to go on a motorcycle with Noam. "" When he got word that Danielle was missing, he raced back from a trip to Indonesia - getting permission to land in Israel, even though the airspace was closed. Three hours later he went looking for her, tracking her apple watch. It was a journey into a battlefield.  ""We were close to an engagement with seven terrorists, creatures, call them what you want,"" he says. ""They had killed three or four soldiers. After that we took three officers in a jeep and went down south. ""   He found the bullet-riddled car, but there was no sign of Danielle. ""There was a lot of blood inside the car,"" he says. ""I was hoping she wasn't in the car, or that she was wounded but was able to escape, or was taken hostage. ""  Two days later her body was found. ""Everything she touched was with a smile. She never did anything wrong to anyone,"" he says, choking back tears. ""She just loved doing good things. And they [Hamas] just murdered her for no reason. "" Despite the brutal killing of his youngest daughter, Eyal Waldman still believes that the Palestinians should have a state - and soon.  ""We need to change leadership on both sides. And then I hope in two to four years we'll be able to do peace and build two states for the two people and be able to live together next to each other,"" he says. But before that, he wants something else. ""Anyone that was responsible, anyone that was associated with what happened on 7 October 2023, will be eliminated. And we will take care of that,"" he says firmly.  ""We know exactly who came, who raped, who butchered.  We have videos, we have their cell phone numbers. We know who they are. We can eliminate them. And I think we can eliminate Hamas. "" The former Israeli army officer knows about waging war. He served in an elite unit - the Golani Brigade.  He also knows about building bridges. In the past he opened a design centre in Gaza, donated $360,000 (£286,200) to a hospital there, and created jobs for Palestinians both in the Gaza Strip and in the West Bank.  Does he regret that now?  ""No, I don't,"" he replies without hesitation. ""I think we need to do everything we can to make this place the best place to live in. ""And we need to stop killing each other and find a way to live together. I have been working for two-and-half decades trying to make peace. "" Just 10 days before Danielle was killed, she was chatting with her father about the future. ""She said 'you know Dad, I decided I am going to marry Noam,'"" he recalls. ""They were together for six years, and it was an amazing friendship and partnership. They were going to live in the country, raising kids. She wanted many kids and a lot of dogs and horses. "" The devoted young couple - who never got the chance to marry - were buried together instead.",Israeli tech billionaire hopes for peace despite daughter's killing,Eyal Waldman: Israeli tech billionaire hopes for peace despite daughter's killing,"israel,israel-gaza_war,hamas,gaza",http://bbc.co.uk/news/world-middle-east-67679634,articles/article_1762.txt,results/article_1762.txt.json
1763,2023-12-07 16:24:34.549000+00:00,/news/articles/c84vdnjv2dvo,"Dr Elliot Sorene and his Israeli-born wife Merav are lighting candles at their north London home, bringing in the Jewish festival of Chanukah, having experienced what they call “the worst two months of their lives”. For Dr Sorene, a consultant orthopaedic surgeon, the 7 October Hamas attacks were particularly personal as his son Ariel was caught up in the Supernova massacre, where 365 attendees were killed, hundreds wounded and 40 kidnapped at a rave. Ariel - who has dual British-Israeli citizenship - heard rockets while at the trance party in southern Israel - before seeing militants shoot indiscriminately at the partygoers. Dr Sorene said: “It was horrific. My son nearly died. He was shot at and ran to safety. Some of his friends didn’t make it. I’m so thankful he’s alive. ” As is the case with many in the capital - which has the UK's largest Jewish community - the Sorenes have numerous connections with those affected directly by the latest wave of violence. Dr Sorene, who spent years living and working in Israel including as a hospital surgeon, says he has lost friends who were killed by Hamas. “These last two months have been the worst two months of our lives; we’ve been racked with worry about what’s going on in Israel and we’ve also seen a horrendous uptick in London of antisemitic incidents, where Jews don’t currently feel safe. ” The Sorenes have three daughters who go to a London Jewish school. Since 7 October, they have become increasingly worried about a spike in antisemitism in London including cases of harassment, violence and schools being targeted, along with instances of antisemitism associated with the weekly pro-Palestinian marches in the capital. “We don't know what’s going to be. It all feels very unsafe. I'm worried about my daughters who speak Hebrew at home, so I ask them not to speak Hebrew outside,"" says Merav Sorene, who is an aesthetic nurse. “I wear my Magen David (Star of David) under my shirt, and I'm very conscious about that. And it's suddenly things have been very abnormal living in London. ” The Metropolitan Police said it had scaled up its visible presence since the Gaza war began, amid a significant increase in Islamophobia and antisemitism. In the period between the Hamas attack and 27 October, the Community Security Trust, a British charity, said it had recorded 805 antisemitic acts, the highest number in a three-week period since it began documenting episodes of this kind in 1984.  Dr Sorene says he has personally experienced abuse since 7 October. “I’ve been called a Christ killer, a baby killer. I've been told people [are] proudly supporting Hamas, supporting their terror attack, supporting what happened on the 7th of October. “I was born in this country, have lived here all my life; my father fought in the Second World War for the British army. We have always contributed to British society. Now we feel hatred and violence towards us. ”",Jewish Londoners suffer 'worst two months',Jewish Londoners suffer 'worst two months',"israel,israel-gaza_war,hamas,gaza",http://bbc.co.uk/news/articles/c84vdnjv2dvo,articles/article_1763.txt,results/article_1763.txt.json
1765,2023-12-07 13:41:16+00:00,/news/world-africa-67622511,"Kenya is sending 1,500 farm workers to Israel, the labour ministry has said. The announcement comes nearly two weeks after Malawi sent 221 young people to work on Israeli farms, triggering a backlash against the government there. The casual workers will be deployed on three-year renewable contracts, ""with a guaranteed net [monthly] income"" of $1,500 (£1,195), Kenya said. Israel has turned to Africa to fill a severe labour gap on its farms, after a mass exit of foreign workers. More than 10,000 migrant farm workers - mostly Thailand nationals - have left Israel since the start of the war with Hamas in early October. Israel has also barred Palestinian workers, who made up nearly 20% of the agricultural labour force prior to the war. Israel's ambassador in Kenya, Michael Lotem, told the BBC that Israel was planning to recruit farm workers from Uganda as well, while recruitment in Tanzania had already started.   ""We are looking to East Africa to fill the labour gap as we have had student internships programmes in place for many years with these countries and it has been a good experience,"" Mr Lotem said. He added that the labour shortage had been caused by the fact that an estimated 360,000 Israeli reservists have been called up for military service since the war started.  He did not cite work restrictions on Palestinians or the departure of foreign nationals as the reasons for the shortage. Israel's agriculture ministry told CNN last week that the country needed 30-40,000 farm workers. The announcement has sparked mixed reactions in Kenya, with some concerned about the workers' safety. At least 32 Thai farm workers were killed and several others taken hostage when Hamas attacked Israel on 7 October. Tanzanian student Clemence Felix Mtenga - who was in Israel as an agriculture intern - was also killed in the attack, while another Tanzanian student, Joshua Loitu Mollel, is still missing.  Critics have also questioned the conditions the workers will face in Israel. In 2018, a BBC investigation found that many migrant farm workers in Israel were subject to unsafe working practices and squalid, unsanitary living conditions. Some were overworked, others underpaid, and there were dozens of unexplained deaths. Rights groups like Human Rights Watch have also previously raised the alarm over Israel's treatment of foreign farm labourers. At the time Israel denied the accusations and has since said that foreign workers enjoyed the same employment rights as Israeli citizens. Mr Lotem said extra measures have since been put in place to ensure foreign workers are treated fairly and that any foreign worker can now file a complaint which will be quickly tracked. Some Kenyans have supported the deal, saying it provides badly needed jobs at a time when Kenya is battling an unemployment crisis and the rising cost of living. Kenya has an unemployment rate of 5.5%, according to the World Bank. Malawi's government has also announced that it will send 5,000 more young people to work on Israeli farms, rejecting calls to drop the plan. ""People are going out of desperation,"" said William Kambwandira, the executive director at the Centre for Social Accountability and Transparency, a workers' rights watchdog based in the capital Lilongwe. ""Given that the war is happening, we are concerned about the welfare of these young men and women,"" he added. However, Mr Lotem told the BBC that the farm workers would not be placed in areas close to the conflict, and they would have the same protection as Israelis. The promise of a secure job and higher salary has pushed safety worries aside for many of the Malawian workers going to Israel. Andrew Chunga, 27, was part of the first group of 221 Malawians who took up jobs in Israel last month.  He is currently living in a two-bedroom house with two other Malawians on a farm in Gefen in central Israel, and has spent the first week removing weeds.  ""This is all about money. I am here for greener pastures. ""When I go home, I will be a millionaire,"" Mr Chunga said laughing.  Jamison Kupatamoyo, 27, is another Malawian who has been working in Israel since last month.  He said he was thrilled to get the job as it will help him gain agriculture training and send a good wage back to his family.  ""I'll be in Israel for five years but will go back to Malawi every year for a holiday,"" Mr Kupatamoyo told the BBC.  ""There is unemployment in Malawi, and the salaries are low [there], compared to here in Israel,"" he added. Asked if he was worried for his personal safety, Mr Kupatamoyo replied: ""I was already aware about the conflict in Israel, but there is a lot of fake news on social media.  ""It is only small parts of Israel that are affected - not the whole country. ""  Mr Kupatamoyo said his employment agency had talked to him about the conflict. ""They explained everything about the war and assured us that where we are going is a safe place and we have witnessed that so far. "" A 31-year-old man in Lilongwe told the BBC he would be travelling to Israel soon to take up a job after being unemployed for four years.  ""My email address has more than 300 sent messages applying for jobs. I have diploma and a bachelor's degree,"" said Alex, who asked for his surname to be withheld.  He does have some safety concerns.  ""We have been assured that the conflict has nothing to do with us. They told us about security measures like missiles detectors and safe houses. ""","Kenya to send 1,500 farm workers to Israel",Kenya follows Malawi in sending farm workers to Israel amid Hamas war,israel,http://bbc.co.uk/news/world-africa-67622511,articles/article_1765.txt,results/article_1765.txt.json
1766,2023-12-08 06:15:28+00:00,/news/uk-england-london-67648377,"A couple who got trapped in the West Bank as the Israel-Gaza conflict broke out say they are traumatised and afraid for their relatives who remain there. Palestinians Imad Alqasim and Zeina Ramadan, who live in London, said it took days to leave with their child. The husband and wife say they have struggled to eat and sleep since returning to the capital. Ms Ramadan also said she was ""living in a nightmare"" and felt ""guilt for being able to leave"". Mr Alqasim and Ms Ramadan were visiting extended family in Nablus and then travelled to Ramallah in the central west Bank. The couple were looking forward to visiting Bethlehem and Jerusalem but all this changed when news reached them that Hamas had launched an attack on Israel on 7 October. Mr Alqasim said ""people started being a bit terrified"" and taxi drivers advised them not to travel because ""it was not safe"", so they cancelled their trip to Bethlehem and remained in Ramallah hoping things would improve. Instead the situation became worse. ""I didn't leave the home at all and someone came and brought food to the place we were in because we couldn't actually move. "" Mr Alqasim and Ms Ramadan decided to cancel their other trips and ""leave as quick as possible"" once the border reopened. However, the couple realised Ms Ramadan could not return to London initially as she is a Palestinian citizen unlike Mr Alqasim, who has British citizenship. He said it was ""a hard decision"" to leave his wife and child behind, something he later regretted. ""I thought if I was outside I could be a little bit more helpful in trying to get her out,"" said Imad. Ms Ramadan said although she grew up in the area and was familiar with it, having her baby daughter with her made her feel more vulnerable. ""No-one knew if the road was safe, [my husband] was asking the driver if that road was safe and he was saying 'we don't know - we don't know if the road is open, we don't know if the road is safe',"" she said. Mr Alqasim managed to cross the border to Amman in Jordan, while Ms Ramadan returned to Nablus, which she said was under siege and officially announced as a closed area by the Israeli army. When she and their daughter finally made it to Amman two days later they flew back to the UK, arriving in London on 13 October but their ordeal is still continuing as they process being apart from their relatives in the West Bank. ""It was the hardest thing I've ever been through, Ms Ramadan said, adding: ""We weren't eating properly, we weren't sleeping properly. "" ""Part of my brain was trying to function - what happened, how we were separated for a while as a family, how I made a decision to leave. ""I felt guilty for being able to leave. . . I still feel this guilt. "" She continued: ""Seeing people in the streets; of course they're living their normal lives but something shifted in my head.  ""It makes you feel unreal, it makes you feel like, 'I'm living in a nightmare, this is not real'. Even though almost every generation of her family have lived through periods of conflict and the trio are physically safe in London, Zeina said she doesn't ""feel safe"". ""When you start your day you need some time to try to understand that you're not there and there's nothing you can do about it except to move on with your life. "" ""There is a collective grief, but we don't even have time to grieve. It doesn't stop,"" she explained. ""There are some moments where you break down with even minor things. There's a lot of talk about post-traumatic [stress] but there is no post, there is no post. . . because that has been my whole life,"" she said through tears. ""I just want things to be over and then we can think about grief,"" Ms Ramadan said. ""I need to be strong for [my daughter]. "" Additional reporting by Alice Bhandhukravi. Listen to the best of BBC Radio London on Sounds and follow BBC London on Facebook, X and Instagram. Send your story ideas to hello. bbclondon@bbc. co. uk",London couple traumatised after fleeing West Bank,Israel-Gaza: London couple traumatised after fleeing West Bank,"israel-gaza_war,gaza",http://bbc.co.uk/news/uk-england-london-67648377,articles/article_1766.txt,results/article_1766.txt.json
1768,2023-12-09 06:51:06+00:00,/news/world-europe-67657837,"Emmanuel Macron has been accused of betraying the French Republic after he took part in a Jewish ceremony inside his official residence, the Elysée Palace. In a country where the separation of religion is itself a religion, the lighting of a Hanukkah candle inside the historic Salle des Fêtes on Thursday was immediately denounced by politicians of both right and left. The president had invited France's Chief Rabbi Haïm Korsia to light the first of eight candles on a Hanukkiah, or candelabra, marking the start of the Jewish festival of lights. The occasion was the award to President Macron of a prize for his efforts against antisemitism.  But when video of the ceremony appeared shortly afterwards on social media, there was furore. For French opinion-formers of all stripes, the president had committed an enormous faux-pas by allowing religion into the secular hallows of the presidency. ""As far as I know this is the first time this has ever happened. It is a breach of secularism,"" said David Lisnard, a prominent right-wing opposition figure who is also mayor of Cannes. ""The Elysée is not a place of religion. You cannot compromise with secularism,"" said the Socialist president of the Occitania region, Carole Delga. ""Will Macron now do the same for other religions? Some yes, some no? It's a dangerous spiral,"" said Alexis Corbière of the far-left France Unbowed. Even some French Jews were perplexed. ""This is something that shouldn't be allowed to happen again,"" said Yonathan Arfi who heads the Representative Council of French Jewish Institutions (Crif). ""French Jews have always considered secularism as a law of protection and of freedom. Anything that weakens secularism weakens Jews,"" he said.  The idea of ""secularism"" was put into a French law of 1905, after years of struggle between the state and the Roman Catholic Church. It enshrined freedom of belief, but ended state involvement in the Church and removed all signs of religion from public buildings. The law has since come to be regarded as a cornerstone of modern France, ensuring strict neutrality between Christianity, Islam and Judaism, and guaranteeing that citizens are seen as individuals-in-a-state and not as members-in-a-community.  For Emmanuel Macron to have breached a century-old Republican doctrine will be seen by critics as confirmation of his overweening self-belief and ""Jupiterian"" entitlement. Speaking on Friday as he viewed renovation work at Notre-Dame cathedral, the president said he had no regrets, and that his invitation to the chief rabbi had been made ""in the spirit of the Republic and of concord"". ""If the president had actually carried out a religious act, or taken part in a ceremony, that would indeed have been a breach of secularism. But that is not what happened,"" he said. The gesture comes at the end of a long political sequence over Gaza in which President Macron has been under attack for improvising policy on the hoof. Critics say he has failed to present a consistent line on the war, instead zigzagging from overclose proximity to the Israeli side at one moment, to intense courting of Arab opinion at the next: always with the aim of appeasing the large Jewish and Muslim populations in France. Shortly after 7 October, Mr Macron visited Israel and proposed an international coalition against Hamas, much like the one that defeated so-called Islamic State (IS).  Accused of abandoning France's traditional backing for Palestinians, he then organised an international aid conference on Gaza to which Israel was not invited.  He then further angered some Jews by refusing to attend a march against antisemitism, and in a BBC interview he spoke of ""babies"" being bombed by the Israeli air force. Some have detected in this latest gesture at the Elysée a new, single-handed touch to the tiller of state. In France's foreign ministry, which has been largely sidelined by President Macron, off-the-record interviews make clear the frustration among professional diplomats. ""One day Macron is on the verge of announcing that he's going to help the Israeli army wipe out Gaza. Two weeks later he's on the BBC calling Israel a baby-killer,"" one former diplomat told Libération newspaper. ""OK, we know it is all about internal politics. But here, he's alienating first the Muslims, then the Jews. """,Macron buffeted from all sides in French religion row,France's Emmanuel Macron buffeted from all sides in row over secularism,israel-gaza_war,http://bbc.co.uk/news/world-europe-67657837,articles/article_1768.txt,results/article_1768.txt.json
