id,date,href,text,title,title_from_page,topic,url,article_file,results_file
1811,2023-12-13 21:15:26+00:00,/news/uk-england-london-67706283,"Students and staff at a London university have expressed their frustration about it not issuing a statement after a former student died. Dr Refaat Alareer, who taught English literature at the Islamic University in Gaza, studied at University College London (UCL) in 2007. The writer and literary scholar was killed in an air strike in Gaza. A UCL spokesperson said: ""We are working to support all those affected by this. "" A vigil organised by UCL Palestine solidarity, a network of staff and students at UCL, was held on Wednesday afternoon. ""Dr Refaat is beloved by a lot of people in the academic community,"" Amna Ghaffar, a UCL student from east London told BBC London. ""He was a UCL alumna and we feel the institution is not recognising or acknowledging or paying respect to him. "" Since his death, Dr Alareer's final poem ""If I must die"" has been shared hundreds of thousands of times online. ""He wanted to teach English to Palestinians so that their voices could be heard beyond the borders of their country,"" Ms Ghaffar, who is from Pakistan, said. ""He was a voice for the voiceless. "" BBC London reporter Alpa Patel, who was at the vigil, said students of many different nationalities including Turkish, Egyptian and British, cried and held hands during the poetry reading.  The poem was read out in different languages, including Greek, to reflect the diversity of the university, and to show how Dr Alareer had touched the lives of many people, she added. Rana, from north London and who was also at the vigil, said Dr Alareer was a ""beloved lecturer"". ""His students loved him, adored him, and people have read his work,"" she said. ""I think he meant a lot to all of us. ""He's not the first cultural figure that has been killed by Israeli forces. ""This administration of the university is still refusing to condemn his killing, to issue a statement. "" Dr Alareer's father-in-law said that the academic died along with his brother and sister and four of her children on 6 December. He had declined to leave northern Gaza following the start of Israeli operations in the area.  A UCL spokesperson said: ""The ongoing violence and suffering in Gaza and Israel is terribly distressing and we recognise the deep impact it has had on UCL's community, many of whom are directly affected and greatly concerned.  ""We are working to support all those affected by this. "" Listen to the best of BBC Radio London on Sounds and follow BBC London on Facebook, X and Instagram. Send your story ideas to hello. bbclondon@bbc. co. uk",UCL urged to issue statement on ex student's death,Refaat Alareer: UCL urged to issue statement on ex student's death,israel-gaza_war,http://bbc.co.uk/news/uk-england-london-67706283,articles/article_1811.txt,results/article_1811.txt.json
1812,2023-12-17 18:42:02+00:00,/news/world-middle-east-67736723,"UK MP Layla Moran says her relatives are among hundreds of civilians trapped in a Catholic Church in Gaza City as Israeli forces operate nearby. The Liberal Democrat says her family are ""days away from dying"" without access to water or food. The Latin Patriarchate of Jerusalem say a mother and daughter were killed inside the Holy Family Church complex on Saturday by sniper fire. The IDF said it found no evidence to show the incident took place. In a statement, the Israel Defense Forces said: ""During the dialogue between the IDF and representatives of the community, no reports of a hit on the church, nor civilians being injured or killed, were raised. ""A review of the IDF's operational findings support this. "" The Latin Patriarchate of Jerusalem said two Christian women - named as Nahida and her daughter Samar - were shot and killed while walking to a building in the church complex known as the Sister's Convent.  ""One was killed as she tried to carry the other to safety,"" a statement said. Seven more people were shot and wounded as they ""tried to protect others inside the church compound"" on Saturday.  The patriarchate said no warning had been given and added: ""They were shot in cold blood inside the premises of the parish, where there are no belligerents. "" The patriarchate said that earlier on Saturday an Israeli tank fired on part of the church compound with 54 disabled people inside. It caused a fire that destroyed the building's generator, the only source of electricity, and some of the disabled people can no longer use their respirators, the statement said. Members of Ms Moran's extended family - a grandmother, her son, his wife and their 11-year-old twins - are Christian Palestinians who sought refuge inside the church after their home was bombed in the first week of the war. They have been staying on mattresses along with dozens of others in rooms in the Holy Family Church for more than 60 days. ""I'm now no longer sure they are going to survive until Christmas,"" Ms Moran told the BBC. They have been keeping in touch with Ms Moran and other family members sporadically through WhatsApp messages and calls - though they have no internet and power is intermittent.  A sixth member of the family - a grandfather - died last month after not being able to get to hospital to receive medical treatment, Ms Moran says. The five remaining members say they now no longer have access to food or water, and the last remaining generator - which was pumping water from wherever they could get it - has stopped working in the church. They say soldiers entered the church compound in the last 24 hours and took over a room in a building.  Earlier in the week, the family heard shots being fired and saw bullet casings in the church compound. They say two men were killed on Tuesday while they were coming and going from the building - a bin collector and a janitor.  The family have sent a photo, seen by the BBC, of two bodies lying on a street outside the church building. Ms Moran's relatives say the bodies have been decaying outside for days. The BBC has not verified the circumstances of what the image shows. Ms Moran says there has been no explanation as to why Israeli soldiers would target the church and no warnings or leaflets were sent to people sheltering there. ""It does feel like it's making a mockery of keeping civilians safe,"" Ms Moran adds. Israel says it is carrying out military operations in Gaza to ""eradicate"" Hamas and rescue hostages taken by the group. Early on in the war Israel told people in northern Gaza to move to southern Gaza for their safety. It has also paused military activity in some areas for short periods to allow people to leave. There was also a temporary ceasefire between Israel and Hamas to allow a swap of some Israeli hostages and Palestinian prisoners. However Israel has also bombed southern Gaza, where it told people to go, and a large number of Palestinians have remained in Gaza City and other northern areas. Ms Moran says she has been in touch with a number of countries about getting her relatives out of Gaza, but the situation is ""incredibly complex"". She adds that the family have considered trying to travel to Rafah in southern Gaza near the border with Egypt but say it is too dangerous while no ceasefire is in place. Hamas broke through Israel's heavily guarded perimeter on 7 October, killing 1,200 people and taking 240 hostages - some of whom were released during the brief truce. The health ministry in Gaza, which is run by Hamas, says more than 18,700 people have been killed and 50,000 injured in the enclave since the start of the Gaza war.",UK MP's family among hundreds trapped in Gaza church,UK MP Layla Moran's family among hundreds trapped in Gaza church,"israel,israel-gaza_war,hamas,gaza",http://bbc.co.uk/news/world-middle-east-67736723,articles/article_1812.txt,results/article_1812.txt.json
1813,2023-12-02 22:37:51+00:00,/news/uk-67604423,"The UK will carry out unarmed surveillance flights over the Middle East to search for Hamas hostage locations, the Ministry of Defence says. The flights will help gather intelligence on potential hostage whereabouts. Five British nationals are missing and the UK government has not said how many could be held by Hamas.  ""The safety of British nationals is our utmost priority,"" the MoD said. ""In support of the ongoing hostage rescue activity, the Ministry of Defence will conduct surveillance flights over the eastern Mediterranean, including operating in air space over Israel and Gaza. "" It added that the aircraft will be unarmed and will be tasked solely to locate hostages. ""Only information relating to hostage rescue will be passed to the relevant authorities responsible for hostage rescue. "" The aircraft will include Shadow R1s, which the Royal Air Force use for intelligence gathering, ministry officials said. Information on the potential locations of hostages will be shared with Israel. More than 130 captives are thought to be in Gaza. The Pentagon said unarmed UAV drones had been deployed over Gaza in ""support of hostage recovery efforts"", earlier this month. ""The US is conducting unarmed UAV flights over Gaza, as well as providing advice and assistance to support our Israeli partner as they work on their hostage recovery efforts,"" the Pentagon said.  Fighting resumed on Friday after a week-long truce in Gaza. The IDF said it had hit more than 400 Hamas targets on the first day. Gaza's Hamas-run health ministry says at least 193 people have been killed in the latest wave of Israeli attacks. The ministry says more than 15,200 people have died in the war in Gaza, sparked by Hamas's attack on Israel on 7 October that killed at least 1,200 people.",UK surveillance planes to look for Hamas hostages,Israel-Gaza: UK launches surveillance flights to find Hamas hostages,israel-gaza_war,http://bbc.co.uk/news/uk-67604423,articles/article_1813.txt,results/article_1813.txt.json
1814,2023-12-20 01:28:20+00:00,/news/world-middle-east-67765866,"Last-minute negotiations have delayed a UN vote on a draft resolution calling for a ceasefire in Gaza.  Wrangles over the wording of the Security Council resolution, reportedly to avoid another veto by the US, mean the vote has moved to Wednesday.  Increased pressure for a suspension of fighting between Israel and Hamas comes as the leader of Hamas is expected to travel to Egypt for talks.  Ismail Haniyeh is due in Cairo later on Wednesday, a source told the BBC.  Egypt, alongside Qatar, helped broker a truce last month that led to a week-long ceasefire and the release of some 100 hostages captured by Hamas in exchange for hundreds of Palestinians being held in Israeli jails. Israeli leaders have rejected a new ceasefire since then, saying it would only benefit Hamas. But on Tuesday Israeli President Isaac Herzog said the country was ready for another pause in the fighting to enable more hostages to be released. Hamas official Osama Hamdan told a news conference in Beirut on Monday that the group was ""open to any initiative aiming for a ceasefire"", but he insisted there would be ""no negotiations on a hostage swap deal until the Zionist [Israeli] aggression completely stops"". The original draft Security Council resolution proposed by the United Arab Emirates (UAE) called for an ""urgent and sustainable cessation of hostilities"" to allow ""safe and unhindered humanitarian access"". Initially diplomats thought they were very close to an agreement, 99% of the way there, but the final discussions have been complex, according to the UAE. The US says it is engaging constructively with other members to resolve outstanding issues.  Late on Tuesday, the US Deputy Ambassador to the UN, Robert Wood, was asked by the BBC whether the US supported the draft resolution and he said: ""We're still working on the text with other players and I don't want to get ahead of where we are at this point. So let's just see how the discussions go this afternoon. ""  Diplomats say the main sticking points are how to frame calls for a cessation of hostilities and the proposal for a UN mechanism to inspect aid going into Gaza.  The US, along with Israel, opposes a ceasefire because they say it would benefit Hamas. Washington vetoed a previous Security Council resolution demanding one. The UK abstained, but every other member supported it. And Israel, according to one Security Council diplomat, is pressuring the US to veto this resolution as well, out of fear that a UN mechanism to monitor aid would prevent them from controlling deliveries in Gaza.  When US state department spokesperson Matt Miller was asked whether Israel had asked the US to veto it, he said they had been in discussions with their ally, as well as other countries in the region, and they would ultimately make their own determination about what the best course of action was depending on what the final resolution stated.  The current draft has already been watered down and now calls for a suspension of hostilities, rather than a sustainable cessation of hostilities, but it still includes a phrase calling for ""urgent steps"" towards a sustainable cessation of hostilities.  The UAE's Ambassador to the UN, Lana Nusseibeh, said the priority and focus of the resolution were to have a real impact on the ground with a scaling-up of access, the opening of all land, sea and air crossing points, and ensuring Egypt has the support it needed from the UN in the form of a mechanism to streamline the process of monitoring aid.  But overriding all of that, she said, was ensuring that humanitarian workers could deliver aid safely and were protected by the normal rules of de-confliction.  But the Israeli government is under growing international pressure to agree to a ceasefire because of the mounting civilian casualties in Gaza.  It is also facing pressure at home for a deal that would see more hostages freed, after Israeli soldiers mistakenly killed three Israeli men who had been held captive in Gaza last week. Gaza has been devastated by the war, which was triggered by an unprecedented cross-border attack by Hamas gunmen on southern Israel on 7 October, in which at least 1,200 people were killed - most of them civilians - and about 240 taken hostage. Since then, more than 19,600 people have been killed in Gaza, about 70% of them women and children, according to the territory's Hamas-run health ministry. It reported that about 100 Palestinians had been killed in Israeli air strikes on Tuesday.  Ahead of the Security Council meeting, UN aid workers in Geneva could not hide their despair at the failure of the international community to put an end to the conflict and tackle the rapidly deteriorating humanitarian situation in Gaza. Unicef spokesman James Elder, who recently returned from the territory, told reporters that ""every single child is enduring these 10 weeks of hell and not one of them can escape"". He lamented that ""not even lip service"" had been paid to requirements, under international law, to safeguard medical facilities, food and water.  Only eight of Gaza's 36 hospitals are still partially functioning, according to the World Health Organization. They are overwhelmed by casualties and facing critical shortages of medical supplies and fuel for generators, as well as providing shelter for thousands of displaced people. WHO spokeswoman Dr Margaret Harris said her colleagues in Gaza had run out of ""words to describe the horror"" they were witnessing. They were not even able to walk through emergency wards at ""for fear of stepping on people"" lying on the floor ""in severe pain"" and asking for food and water, she added.",UN Gaza vote delayed as ceasefire calls grow,Israel Gaza: Negotiations delay UN vote urging pause in fighting,"israel,palestinian_territories,israel-gaza_war,hamas",http://bbc.co.uk/news/world-middle-east-67765866,articles/article_1814.txt,results/article_1814.txt.json
1815,2023-12-13 03:32:50+00:00,/news/world-middle-east-67699508,"The UN General Assembly has overwhelmingly adopted a non-binding resolution demanding an immediate humanitarian ceasefire in Gaza. On Tuesday, 153 member states in the 193-strong assembly voted in favour and 10 including the US and Israel against, with 23 abstentions. Palestinian representative Riyad Mansour said it was a ""historic day"". Israel's envoy Gilad Erdan said before the vote that a ""ceasefire only serves to prolong Hamas's reign of terror"". Senior Hamas official Bassem Naeem told the BBC that the passing of the resolution confirmed that ""the prevailing international will is in favour of stopping the aggression against the Palestinian people"". Although the US voted against the resolution, US President Joe Biden had earlier warned that Israel was losing international support because of ""indiscriminate bombing"" of Palestinians.  He also expressed disagreement over plans for the future of the Gaza Strip, saying the Israeli government appeared opposed a two-state solution with the Palestinians. Tuesday's vote was the second attempt by the General Assembly to stop hostilities. In October, it had called for ""a humanitarian truce"" in a resolution adopted with 121 votes in favour, 14 against and 44 abstentions. Although non-binding, such resolutions are seen as a powerful measure of international opinion, analysts say. UN Secretary General António Guterres has long been pushing for a humanitarian ceasefire to prevent a ""complete breakdown of public order"" in Gaza. Last Friday, the UN Security Council - the body tasked with global peace and security issues - failed to adopt a draft resolution calling for a truce in Gaza. The US - one of the council's five veto-wielding council members - blocked the move.  Israel has been carrying out air strikes and a ground offensive in the Gaza Strip after a Hamas attack on Israel on 7 October in which Israeli officials say 1,200 were killed and another 240 taken hostage. Some of the abductees were later released during a brief truce.  The Hamas-run health ministry in Gaza says Israel has killed more than 18,200 people and injured at least 50,000, including many women and children, during its ongoing military operation.",UN General Assembly demands immediate Gaza ceasefire,Israel Gaza: UN General Assembly demands immediate ceasefire,"israel,israel-gaza_war,hamas",http://bbc.co.uk/news/world-middle-east-67699508,articles/article_1815.txt,results/article_1815.txt.json
1816,2023-12-15 21:11:30+00:00,/news/world-middle-east-67732347,"The ""dehumanising"" treatment of paramedics, ambulances shot at, and unexploded bombs on the road. Jake Morland, a British aid worker with the UN's Office for the Coordination of Humanitarian Affairs (OCHA), has given the BBC his eyewitness account of a high-risk mission to transfer patients under appalling conditions in Gaza. Last Saturday, 9 December, a joint World Health Organisation (WHO)/UN/Palestine Red Crescent Society convoy of six ambulances and a truck set off from southern Gaza to deliver desperately-needed medical supplies to the al-Ahli Hospital in the north, and to transfer critically-injured patients from there to a hospital in the south. To get to al-Ahli, the convoy had to pass through the Israel Defense Forces (IDF) checkpoint at Wadi Gaza. ""The one thing we expect when we go through a checkpoint in any military setting is free access for humanitarian personnel and goods"", says Mr Morland, who has been a UN aid worker for 20 years. But this time, he says, ""we approached huge sand dunes with Israeli soldiers standing on the top with their machine guns squarely aimed at the Palestinian paramedics, at the UN vehicles, and at the UN trucks carrying medical supplies"". As they were held there for over an hour, two of the Palestinian paramedics were led away for questioning. ""We understand one was put on his knees, stripped and detained for some time until we were able to negotiate his release and carry on to Gaza,"" says Mr Morland. ""These moves (of aid) are clearly co-ordinated with the IDF,"" he says. ""We provide all the details of what's on the convoy, what it's going to do, and indeed the names of all the members of the convoy… So what was really a dehumanising treatment of Palestinian colleagues was unacceptable. "" From Wadi Gaza, the aid convoy pressed on north into the old city of Gaza, which Mr Morland describes as a rabbit warren of debris-strewn streets - with unexploded ordnance on the road and beside it. ""We were also shot at. The ambulance took a couple of bullets as indeed did a truck. So it really was putting humanitarian workers' lives on the line as they went to try and save lives. "" On the return journey south, they were again held up at the checkpoint - but this time they were carrying 19 critically injured patients from a tiny trauma hospital in Gaza City, so every minute counted. ""All of these patients had life-critical injuries - amputations; horrific wounds that needed immediate attention. We were held for over two hours at the checkpoint. The walking wounded were forced at gunpoint from the ambulance and again were stood in the sand to be profiled by the IDF,"" Mr Morland recalls.  ""Even the children who were wounded and terrified were carried out by the paramedics, and stood there for over an hour while pictures were taken. ""  Eventually, as night fell and the sound of air strikes grew closer, the group had to take a difficult decision: to leave behind one of the paramedics who was still detained by the IDF. ""We had patients who were literally dying because of all the delays that were being imposed on us,"" says Mr Morland. ""I heard that one of the patients died from his injuries on the way to a hospital in the south. We think that may have been avoidable if we'd been allowed free and fair access through the checkpoint. ""  We put these allegations to the IDF, who told us that one of the Palestinian paramedics was detained because he was suspected of ""association with terror activities"". The IDF said they encouraged the rest of the convoy to move on south, but that of the six ambulances containing injured patients, three opted to remain with the suspect despite being encouraged to move to the southern hospital.  Regarding the patient who reportedly died, the IDF said this was only reported to them days later and they have yet to be able to independently confirm it. For Jake Morland though, it was not just the hardship of getting a medical convoy through IDF lines that shocked him - it was what he witnessed in Gaza's al-Ahli Hospital that day. ""This is a hospital that normally treats 80 patients with 80 beds,"" he says. ""There are currently over 200 patients in that hospital. ""They're no longer dealing with broken bones. They're now dealing with life-threatening wounds; horrific, shrapnel wounds.  ""I've never seen so many people dying in front of me. They were lying on stretchers with horrific wounds next to body bags. The scenes were horrific. And yet these Palestinian paramedics and the other aid workers that go there (to northern Gaza) time and time again - at great risk to themselves - act with compassion and dignity, and help these patients, and try to bring them to safety"".  Asked what the wounds were caused by, Mr Morland says: ""They are just praying for the bombs to stop raining down on them in Gaza City, and they are all wounds and injuries of war. Pure and simple. "" On Wednesday, the WHO put out its own statement, calling for healthcare and humanitarian aid workers to be protected.",UN aid worker describes nightmare Gaza journey,Israel-Gaza war: UN aid worker describes nightmare journey to al-Ahli Hospital,"israel,palestinian_territories,israel-gaza_war",http://bbc.co.uk/news/world-middle-east-67732347,articles/article_1816.txt,results/article_1816.txt.json
