id,date,href,text,title,title_from_page,topic,url,article_file,results_file
1719,2023-12-08 22:08:08+00:00,/news/world-middle-east-67664854,"The armed wing of Hamas has released a video which it says shows the bloody aftermath of a failed Israeli operation to free an Israeli hostage. In the footage, a man says he has been held for 40 days, suggesting the video may have been recorded in mid-November. A lot of blood is seen on a tiled floor, as well as military equipment, which Hamas claims to have captured.  The video ends with gruesome images of a bloodied body that appears to be that of the same hostage seen earlier. We are withholding the man's name - he says this and his age in the video.  A script in Arabic says that Israeli soldiers ""failed to reach"" the hostage, leading to his death, and that the Israeli team ""quickly fled the place"".  It claims that the Israel Defense Forces (IDF) used an ambulance to reach the place where the hostage was being held.  The BBC has not verified the video and has no confirmation of the claims made by Hamas in it. At a briefing on Friday evening, chief IDF spokesman Daniel Hagari confirmed that two Israeli soldiers were seriously wounded during operations in Gaza to free hostages.  He said ""terrorists who participated in the kidnapping and holding of hostages"" had been killed, but he said no hostages had been released. It is not clear if he was talking about the same incident described in the Hamas video or something else. The IDF launched its military operation in Gaza after a deadly Hamas attack on Israel on 7 October. Israel says 1,200 people were killed and 240 taken hostage in the Hamas attack. A number of hostages were later released during a short-lived ceasefire - but not those who Hamas claims to be linked to the Israeli military. Hamas says Israel has killed more than 17,177 people in its retaliatory campaign, including about 7,000 children.",Hamas claims Israeli raid ended in hostage death,Hamas claims Israeli operation ended in hostage death,"israel,israel-gaza_war,gaza",http://bbc.co.uk/news/world-middle-east-67664854,articles/article_1719.txt,results/article_1719.txt.json
1720,2023-12-04 17:43:46+00:00,/news/world-middle-east-67613153,"Hamas had a premeditated plan to use sexual violence as a weapon of war, an Israeli women's rights campaigner and lawyer has said. Prof Ruth Halperin-Kaddari said she saw footage of women in several locations whose condition left her in ""no doubt"" that they had been raped. There has been anger over the delay of some UN bodies to acknowledge claims of Hamas's sexual atrocities on 7 October. Israel has been exploring evidence of sexual crimes during the attacks. Warning: This article contains graphic details which some readers may find upsetting Israeli police say they have so far gathered more than 1,500 testimonies from witnesses and medics. Hamas has denied the group carried out sexual violence during the 7 October attacks.  Pictures and live footage streamed by the militants pointed to the gruesome nature of the attacks at the Supernova festival. A range of violence from gang rape to the sexual mutilation of murdered victims are being investigated by police. ""I saw a number of first-hand, eyewitness accounts, for example of one survivor who hid in the bushes and saw a woman next to her being raped by several men,"" Prof Halperin-Kaddari told BBC Radio 4's Today programme. She said she also spoke to a paramedic who treated a woman who lost a life-threatening amount of blood after reporting being raped by four men. ""I saw footage and pictures from numerous locations of bodies whose condition were all exhibiting the same pattern of mutilation and leaving no doubt that rape was performed on these women before they were executed,"" she said. Prof Halperin-Kaddari added that the the concentration of cases, all in one day but in several locations left her in ""no doubt"" that there was a ""premeditation to use sexual violence as a weapon of war. "" Hamas said it ""rejected and strongly denounced"" the reports of abuses. In a post on the messaging app Telegram, it said that such claims were ""lies"" by Israel that sought to distort the ""humane"" way Hamas has treated Israeli hostages. Hamas took some 240 people hostage on 7 October - 110 were released last week as part of a truce with Israel. Israeli women's rights and legal activists had been calling on key international organisations to publicly acknowledge reports of gender-based violence, including sexual violence, in the wake of Hamas's attacks. On Monday, dozens of demonstrators gathered outside the UN headquarters in New York, protesting over what they said was its inaction over the rape, abduction and mistreatment of Israeli women. Prof Halperin-Kaddari, who spent 12 years as a member of a UN convention on discrimination against women, said she and others have been calling on UN bodies to acknowledge these ""crimes against humanity"". ""Regrettably, until a week ago, none of them said the explicit word 'sexual violence'. It took them more than seven weeks,"" she said. The UN has yet to respond to accusations of a delay, but Prof Halperin-Kaddari visited the UN in Geneva just a week ago to draw attention to the violence. UN Women issued a statement - eight weeks after the attacks - acknowledging accounts of gender-based atrocities. ""This took them too long, much too long,"" Prof Halperin-Kaddari added. Yael Sherer from the Lobby to Combat Sexual Violence advocacy group told Today that men were also victims of sexual violence on 7 October. She said evidence is being gathered from some survivors of the attacks, as well as eyewitnesses and first responders, who have been detailing the violence. ""Hamas terrorists made sure to disgrace these people and dishonour them in many ways,"" she said.  This included violence carried out on the victims' bodies after they had died, Ms Sherer added.  ""We also saw people who were bleeding. . . [and] people who were tied down to furniture with zip-ties, and were not clothed, of many ages. "" An ongoing UN commission of inquiry investigating alleged war crimes on both sides of the Israel-Hamas conflict will include a focus on sexual violence carried out during the attacks on 7 October. However, Israel has not so far co-operated with the commission, viewing it as biased.  Navi Pillay, who chairs the inquiry, said if Tel Aviv did not want to co-operate, her team could still take evidence from survivors and witnesses outside the country. ""All they [Israel] have to do is let us in,"" she told the BBC, adding that survivors of the attacks should be able to get a UN hearing. Ms Pillay also rejected claims that the UN delayed acknowledging that sexual violence had taken place during Hamas's attacks and said ""every effort"" was being made as part of her team's investigations. The Hamas attack on Israel on 7 October killed 1,200 people. Since then, Gaza's Hamas-run health ministry says more than 15,500 people have been killed in Israel's military campaign which it launched in response.",Hamas planned rape as weapon of war - Israeli lawyer,Hamas planned sexual violence as weapon of war - Israeli campaigner,"israel,israel-gaza_war,hamas",http://bbc.co.uk/news/world-middle-east-67613153,articles/article_1720.txt,results/article_1720.txt.json
1721,2023-12-05 17:15:49+00:00,/news/world-middle-east-67629181,"The BBC has seen and heard evidence of rape, sexual violence and mutilation of women during the 7 October Hamas attacks. WARNING: CONTAINS EXTREMELY GRAPHIC DESCRIPTIONS OF SEXUAL VIOLENCE AND RAPE Several people involved in collecting and identifying the bodies of those killed in the attack told us they had seen multiple signs of sexual assault, including broken pelvises, bruises, cuts and tears, and that the victims ranged from children and teenagers to pensioners. Video testimony of an eyewitness at the Nova music festival, shown to journalists by Israeli police, detailed the gang rape, mutilation and execution of one victim. Videos of naked and bloodied women filmed by Hamas on the day of the attack, and photographs of bodies taken at the sites afterwards, suggest that women were sexually targeted by their attackers. Few victims are thought to have survived to tell their own stories.   Their last moments are being pieced together from survivors, body-collectors, morgue staff and footage from the attack sites. Police have privately shown journalists a single horrific testimony that they filmed of a woman who was at the Nova festival site during the attack. She describes seeing Hamas fighters gang rape a woman and mutilate her, before the last of her attackers shot her in the head as he continued to rape her. In the video, the woman known as Witness S mimes the attackers picking up and passing the victim from one to another. ""She was alive,"" the witness says. ""She was bleeding from her back. ""  She goes on to detail how the men cut off parts of the victim's body during the assault. ""They sliced her breast and threw it on the street,"" she says. ""They were playing with it. "" The victim was passed to another man in uniform, she continues. ""He penetrated her, and shot her in the head before he finished. He didn't even pick up his pants; he shoots and ejaculates. "" One man we spoke to from the festival site said he heard the ""noises and screams of people being murdered, raped, decapitated"". To our question about how he could be sure - without seeing it - that the screams he heard indicated sexual assault rather than other kinds of violence, he said he believed while listening at the time that it could only have been rape.  A statement he made through a support organisation describes it as ""inhuman"".  ""Some women were raped before they were dead, some raped while injured, and some were already dead when the terrorists raped their lifeless bodies,"" his statement says. ""I desperately wanted to help, but there was nothing I could do. "" Police say they have ""multiple"" eye-witness accounts of sexual assault, but wouldn't give any more clarification on how many.  When we spoke to them, they hadn't yet interviewed any surviving victims. Hamas has rejected Israel's accusation that its men sexually assaulted women during the attacks. Israel's Women's Empowerment Minister, May Golan, told the BBC that a few victims of rape or sexual assault had survived the attacks, and that they were all currently receiving psychiatric treatment. ""But very, very few. The majority were brutally murdered,"" she said. ""They aren't able to talk - not with me, and not to anyone from the government [or] from the media. "" Videos filmed by Hamas include footage of one woman, handcuffed and taken hostage with cuts to her arms and a large patch of blood staining the seat of her trousers. In others, women carried away by the fighters appear to be naked or semi-clothed. Multiple photographs from the sites after the attack show the bodies of women naked from the waist down, or with their underwear ripped to one side, legs splayed, with signs of trauma to their genitals and legs.   ""It really feels like Hamas learned how to weaponise women's bodies from ISIS [the Islamic State group] in Iraq, from cases in Bosnia,"" said Dr Cochav Elkayam-Levy, a legal expert at the Davis Institute of International Relations at Hebrew University. ""It brings me chills just to know the details that they knew about what to do to women: cut their organs, mutilate their genitals, rape. It's horrifying to know this. "" ""I spoke with at least three girls who are now hospitalised for a very hard psychiatric situation because of the rapes they watched,"" Minister May Golan told me. ""They pretended to be dead and they watched it, and heard everything.  And they can't deal with it. "" Israel's police chief Yaacov Shabtai said that many survivors of the attacks were finding it difficult to talk and that he thought some of them would never testify about what they saw or experienced.  ""Eighteen young men and women have been hospitalised in mental health hospitals because they could no longer function,"" he said. Others are reportedly suicidal. One of those working with the teams around survivors told the BBC that some had already killed themselves. Much of the evidence has come from the volunteer body-collectors deployed after the attacks, and those who handled the bodies once they arrived at the Shura army base for identification. One of the body-collectors volunteering with the religious organisation Zaka described to me signs of torture and mutilation which included, he said, a pregnant woman whose womb had been ripped open before she was killed, and her foetus stabbed while it was inside her. The BBC has not been able to independently verify this account, and Israeli media reports have questioned some testimony from volunteers working in the traumatic aftermath of the Hamas attacks. Another, Nachman Dyksztejna, provided written testimony of seeing the bodies of two women in kibbutz Be'eri with their hands and legs tied to a bed.  ""One was sexually terrorised with a knife stuck in her vagina and all her internal organs removed,"" his statement says.    At the festival site, he says small shelters were ""filled with piles of women. Their clothing was torn on the upper part, but their bottoms were completely naked. Piles and piles of women. […] When you took a closer look at their heads, you saw a single shot straight to the brain of each. "" Hundreds of bodies were collected from the attack sites by volunteers.   Investigators admit that in those first chaotic days after the attacks, with some areas still active combat zones, opportunities to carefully document the crime scenes, or take forensic evidence, were limited or missed. ""For the first five days, we still had terrorists on the ground in Israel,"" May Golan said. ""And there were hundreds, hundreds of bodies everywhere. They were burned, they were without organs, they were butchered completely. "" ""This was a mass casualty event,"" police spokesman Dean Elsdunne told journalists at a briefing.   ""The first thing was to work on identifying the victims, not necessarily on crime scene investigation. People were waiting to hear what happened to their loved ones. "" It was staff at the army's Shura base, where bodies arrived for identification, who have provided investigators with some of the most crucial evidence. This evidence emerged from a makeshift hub of tents and refrigerated shipping containers set up at the base to identify the bodies. When we visited, hospital trolleys, their iron skeletons topped with khaki stretchers, stood neatly lined up in front of the containers that housed the dead; the white plastic overalls of those on shift translucent under the floodlights. Fighter jets roared overhead, drowning out the cicadas, as Israel's bombardment of Gaza continued. Teams here told us they'd seen clear evidence of rape and sexual violence on the bodies coming in, including broken pelvises from sustained violent abuse. ""We see women of all ages,"" one of the reservists on the forensic team, Captain Maayan, told the BBC. ""We see rape victims. We see women who have been through violation. We have pathologists and we see the bruises, we learn about the cuts and tears, and we know they have been sexually abused. "" I ask her what proportion of the bodies she's handled show signs of this. ""Abundant,"" she said. ""Abundant amount of women and girls of all ages. "" The number of victims is hard to define, partly because of the state of the bodies. ""It's definitely multiple,"" said another serving soldier who asked us to use only her first name, Avigayil. ""It's hard to tell. I've dealt with more than a few burned bodies and I have no idea what they went through beforehand. And bodies that are missing the bottom half - I also don't know if they were raped. But women that were clearly raped? There are enough. More than enough. ""  ""Sometimes we are left only with a very small part of the body,"" Dr Elkayam-Levy tells me. ""Maybe it's a finger, a foot or a hand that they're trying to identify. People were burned to ashes. Nothing was left. […] I want to say that we'll never know how many cases there were. "" Privately some of those working on this talk in terms of ""dozens"" of victims but quickly caution that evidence is still being gathered and pieced together. The civil commission headed by Dr Elkayam-Levy, to collect testimony on sexual crimes, is calling for international recognition that what happened on 7 October was systematic abuse, constituting Crimes Against Humanity. ""We see definite patterns,"" she told me. ""So it wasn't incidental, it wasn't random. They came with a clear order. It was […] rape as genocide. "" Avigayil agrees there were similarities in the violence visited on the bodies that arrived at the Shura base. ""There are patterns in that groups of women from the same place were treated in a similar manner,"" she said.   ""There might be a set of women who were raped in one way, and we're seeing similarities in the bodies; and then a different set that were not raped but shot multiple times in the exact same pattern. So it seems that different groups of terrorists had different forms of cruelty. "" ""This was a premeditative, systematic event,"" police chief Yaacov Shabtai told journalists. David Katz from Israel's cyber crime unit which is involved in the investigation, told journalists that it was too early to prove that sexual violence was planned as part of the attack, but that data extracted from the phones of the Hamas attackers suggested that ""everything was systematic"". ""It would be reckless to say we can already prove it […] but everything that was done there was done systematically,"" he said. ""Nothing happened by coincidence. Rape was systematic. "" Israel's government points to documents it says were found on Hamas fighters that appear to support the idea that sexual violence was planned. It's released clips of interrogations with some captured fighters in which they appear to say that women were targeted for this purpose. Last week, UN Women put out a statement saying it ""unequivocally condemn[ed] the brutal attacks by Hamas"" and was ""alarmed by the numerous accounts of gender-based atrocities and sexual violence during those attacks"". Dr Elkayam-Levy said before the statement that international women's rights organisations had taken far too long to respond to her call for support. ""This is the most documented atrocity humanity has known,"" she told me. ""Israel on 7 October is not the same country that woke up the following morning,"" said police chief Yaacov Shabtai. Amid the horror of what happened to women here, Captain Maayan from the Shura identification unit says the hardest moments are when she sees ""the mascara on their eyelashes, or the earrings they put on that morning"". I ask where that lands in her, as a woman. ""Terror,"" she replied. ""It terrorises us. "" Additional reporting by Scarlett Barter","Hamas raped and mutilated women on 7 October, BBC hears","Israel Gaza: Hamas raped and mutilated women on 7 October, BBC hears","israel,palestinian_territories,israel_and_the_palestinians,israel-gaza_war,hamas",http://bbc.co.uk/news/world-middle-east-67629181,articles/article_1721.txt,results/article_1721.txt.json
1722,2023-12-18 22:04:48+00:00,/news/world-middle-east-67752611,"The armed wing of Hamas, the al-Qassam Brigades, has released a video of three elderly Israeli men being held hostage in the Gaza Strip. The video shows Chaim Peri, 79, Yoram Metzger, 80, and Amiram Cooper, 85. Mr Peri can be seen addressing the camera and calling for their release. About 120 hostages are believed to still be in captivity in Gaza after a deadly Hamas attack on 7 October. Israel's military described the footage as a ""criminal terror video"". ""It testifies to Hamas' cruelty towards innocent, very elderly civilians who are in need of medical care,"" said Daniel Hagari, a spokesman for the Israel Defense Forces (IDF).  ""The world must act in order to deliver medical aid and check on the state of the hostages. We are morally obliged to make every and all efforts in order to bring the hostages back home,"" the spokesman added. The footage was released on the Telegram messaging app. The hostages taken in October are believed to be held by Hamas and allied Palestinian groups. Prisoners of war and hostages are protected under international humanitarian law and so the BBC does not broadcast the full details of material which may have been filmed under duress. A spokesperson for Kibbutz Nir Oz, where the men were abducted from, urged US Defence Secretary Lloyd Austin, who is currently visiting Israel, to secure their release. ""We appreciate any sign of life from the hostages, but time is running out,"" the spokesperson said. ""The immediate release of all those abducted, through any potential negotiation avenue, is urgently required. ""Each passing day exacerbates their situation. Recent events sadly illustrate that the hostages' situation is deteriorating with each passing day, particularly for older individuals. "" An estimated 240 hostages were taken to Gaza during Hamas's 7 October attacks that killed about 1,200 in southern Israel. Israel has launched a massive retaliatory operation it says is aimed at destroying Hamas. More than 18,000 people have been killed in Gaza since, according to the Hamas-run health ministry, with hundreds of thousands displaced. During a six-day ceasefire at the end of November, 105 hostages were released in exchange for Palestinians held in Israeli jails.  On Friday, three Israeli hostages mistakenly killed by Israeli soldiers in Gaza were shot dead while holding a white cloth, an Israeli military official said. The hostages - Yotam Haim, 28, Samer Talalka, 22, and Alon Shamriz, 26 - were killed in the Shejaiya neighbourhood of Gaza City. According to an Israeli military official, who spoke on condition of anonymity, the men emerged shirtless from a building, with one carrying a stick with a white cloth. One of the soldiers, the official added, felt threatened, as the men were at a distance of tens of metres, declared them ""terrorists"" and opened fire. Two were immediately killed while the third, wounded, returned to the building. A cry for help was heard in Hebrew and the battalion commander ordered the troops to cease fire. The wounded hostage later re-emerged, and was shot and killed, the official said. It is not clear if the hostages had been abandoned by their captors or escaped. An IDF official said the case was ""against our rules of engagement"" and an investigation was happening at the ""highest level"". Families of the remaining hostages have urged the Israeli government to reach a new truce for at least some of the captives to be freed.  Israeli Prime Minister Benjamin Netanyahu has deflected the calls, insisting ""military pressure is necessary both for the return of the hostages and for victory"". Speaking to reporters on Monday, US National Security Council spokesman John Kirby addressed rumours of a possible new hostage deal, and said talks were not at a point where an agreement was imminent.",Hamas shows video of three elderly Israeli hostages,Israel Gaza: Hamas releases video showing three elderly Israeli hostages,"israel,israel-gaza_war,hamas,gaza",http://bbc.co.uk/news/world-middle-east-67752611,articles/article_1722.txt,results/article_1722.txt.json
